,name,unit,error,file_name,true_unit
635,Система автоматизированная информационно-измерительная «МАРС МЕРА 3М»,"Сила от тяги, 1 ИК, кН Массовый расход топлива, 1 ИК, кг/c Перепад между атмосферным и полным ГТД, 1 ИК, Перепад между атмосферным и полным давлением воздуха на входе в ГТД, 1 ИК, кПа Температура воздуха на входе в двигатель, 1 ИК, °С (К) 1 ИК, °С (К)","Пределы допускаемой относительной (абсолютной*) ±0,5 % от 0,5 Rmax 1) ИЗ2) ±0,5 % ИЗ2) ±0,5 % от 0,5 Gmax 3) ±0,5 % ИЗ4) ±0,5 % ИЗ4) ±0,05* ±0,5 % ИЗ",2016-64125-16.pdf,1
636,Антенны дипольные активные П6-51М/1,,"Пределы допускаемой погрешности определения коэффициента калибровки, Пределы допускаемой калибровки, дБ ±2",2016-64138-16.pdf,
637,Индикаторы ИЧ и ИЧЦ,"Диапа- зон из- мерений, мм","Наибольшая разность погрешностей инди- погрешностей инди- катора на любом участке участке диапазона измере- измере- ния, мм 4 6",2016-64188-16.pdf,мм
638,Тепловычислители СПТ944,"Диапазон измерений сигналов постоянного тока, соответст- вующих давлению от 4 до 20 мА сопротивления, Диапазон измерений сигналов сопротивления, соответствующих температуре температуре от 80 до 170 Ом сопротивления, соответ- Диапазон измерений разности сигналов сопротивления, соответ- ствующей разности температур от 0 до 170 Ом сигналов, соответст- Диапазон измерений частоты импульсных сигналов, соответст- вующих расходу от 10−4 давления1 0 до 1000 Гц 2,5 давления1 Диапазон показаний давления1 от 0 до 2,5 МПа 50 Диапазон показаний температуры от минус 50 до плюс 175 °C Диапазон показаний разности температур от 0 до 175 °C Диапазон показаний разности температур от 0 до 175 °C 0 106 м3/ч Диапазон показаний объемного расхода от 0 до 106 0 106 м3/ч м3/ч т/ч м3/ч т/ч 0 106 Диапазон показаний массового расхода от 0 до 106 Диапазон показаний объема от 0 до 9·108 т/ч 9·108 м3 т/ч 9·108 9·108 м3 Диапазон показаний объема от 0 до 9·108 0 9·108 9·108 9·108 м3 Диапазон показаний массы от 0 до 9·108 энергии2 0 9·108 т энергии2 0 9·108 от 0 до 9·108 Диапазон показаний тепловой энергии2 ГДж","Пределы допускаемой относительной погрешности измерения частоты импульсных сигналов, соответствующих расходу частоты импульсных сигналов, соответствующих расходу ±0,01 % Пределы допускаемой абсолютной погрешности измерения сигналов сопротивления, соответствующих температуре сигналов сопротивления, соответствующих температуре ±0,1 °С Пределы допускаемой абсолютной погрешности измерения Пределы допускаемой абсолютной погрешности измерения разности сигналов сопротивления, соответствующей разности разности сигналов сопротивления, соответствующей разности температур температур ±0,03 °С изме- Пределы допускаемой приведенной к верхнему пределу изме- рений погрешности измерения сигналов тока, соответствую- щих давлению ±0,1 % вычисле- Пределы допускаемой относительной погрешности вычисле- ния параметров ±0,02 % измери- Пределы допускаемой относительной погрешности измери- тельного канала тепловой энергии (при 3≤Δt≤175 °С) ±(0,5+3/Δt) % ±0,01 % Пределы допускаемой относительной погрешности часов ±0,01 % Габаритные размеры 208×206×87",2016-64199-16-2.pdf,соответст
639,Система автоматизированная информационно-измерительная коммерческого (АИИС КУЭ) «Лукойл-Пермь» -II учета электрической энергии (АИИС КУЭ) ООО «Лукойл-Пермь» -II очередь,,"Пределы допускаемой относительной погрешности ИК при измерении (реактивной) активной (реактивной) электрической энергии в рабочих условиях эксплуатации, % эксплуатации, % ±5,4",2016-64294-16.pdf,
640,Анализаторы спектра FPH,"Штатно от 9∙103 B3 9∙103 до 2·109 3·109 Диапазон рабочих частот, Гц Диапазон рабочих частот, Гц опция B3 от 9∙103 В4 9∙103 до 3·109 4·109  опция В4 от 9∙103 до 4·109","Пределы допускаемой относительной погрешности частоты опорного 10 опорного ±2·10-6 50 генератора 10 МГц N-«розетка»,",2016-64297-16.pdf,Гц
641,Дифрактометры рентгеновские D8 ADVANCE,,"Пределы допускаемой абсолютной погрешности измерений параметров решетки: кристаллической решетки: a, ±0,0001 ±0,001 a, нм с,",2016-64305-16.pdf,
642,Система автоматизированная информационно-измерительная коммерческого 500 «Хехцир-2» учета электроэнергии АИИС КУЭ ЕНЭС ПС 500 кВ «Хехцир-2»,,"Пределы допускаемой относительной погрешности ИК при измерении активной электрической энергии в рабочих (δ), условиях эксплуатации АИИС КУЭ (δ), % ±1,3",2016-64320-16.pdf,
643,Измерители крутящего момента силы МT,"Диапазон измерений, Н⋅м Н⋅м","Пределы допускае- мой относительной статической по- ±0,5 статической по- грешности, %",2016-64405-16.pdf,Н
644,Система автоматизированная информационно-измерительная коммерческого 220 учета электроэнергии ПС 220 кВ Северная в части технологического «Тульская присоединения электроустановок ОАО «Тульская региональная корпорация государственно-частного партнерства» развития государственно-частного партнерства»,,"A Границы допускаемой основной погрешности δWо A погрешности измерения активной энергии δW A и реактивной измерения активной энергии реактивной энергии δW P в рабочих A δW P и погрешности измерения активной энергии δW A условиях применения для ИК № 1, 2 и реактивной энергии δW P в рабочих условиях применения для ИК № 1, 2 ±2,1 ±1,3",2016-64458-16.pdf,
645,Система измерительная СИ-СТ076,,"Пределы допускае- мой погрешности измерений парамет- измерений парамет- ра ±1,0 % от НЗ НЗ=0,39 МПа НЗ=0,39 МПа (НЗ=4,0 кгс/см2) МПа кгс/см2) кгс/см2) (НЗ=4,0 кгс/см2) ±1,0 % кгс/см2)",2016-64470-16.pdf,
646,"Система измерений количества и параметров свободного нефтяного газа ГФУ-1,2 «Башнефть-Полюс» ЦППН УПНГ ООО «Башнефть-Полюс»","Диапазон измерений объемного расхода газа, приведенный к условиям, м3/ч Диапазон измерений объемного стандартным условиям, м3/ч","Пределы допускаемой относительной погрешности измерения (объема) газа, объемного расхода (объема) газа, приведенного к стандартным условиям, % ±5,0 условиям, % эксплуатации:",2016-64497-16.pdf,приведенный
647,Контроллеры программно-логические Платформа автоматизации К-4000,Диапазоны преобразований ана- логовых сигналов/разрядность цифровых сигналов Диапазон входных входных сигналов сигналов от 0 до 20 мА от 4 до 20 мА от 4 до 20 мА от 0 до 5 В от 0 до 5 В,"Пределы допускаемой основной основной погрешности, погрешности, % γ = ±0,1*",2016-64500-16.pdf,
648,"Индикаторы часового типа с ценой деления 0,01 мм","диапазона измерений, измерений, мм ",,2016-64541-16.pdf,мм
649,Стенды балансировочные Securo 1300,"Диапазоны измерений неуравновешенной массы дисбаланса, г от 0 до 350 не-","Пределы допускаемой относительной погрешности измерений не- уравновешенной массы дисбаланса, % - в диапазоне от 0 до 100 г включ. - в диапазоне от 0 до 100 г включ. - в диапазоне св. 100 до 350 г включ. ±3 ±5 - в диапазоне св. 100 до 350 г включ. Диапазон измерений угла установки корректирующей ±5 0",2016-64567-16.pdf,г
650,Дозаторы весовые дискретного действия ДБ,"32, 40, 50, 100, 150, 160, 200, 320, 500, 800, 1000, 1200, 1500 кг Наибольший предел дозирования (НПД) 1000, 1200, 1500 кг",,2016-64575-16.pdf,4
651,Система автоматизированная информационно-измерительная коммерческого 220 «Усть-Лабинская» учета электроэнергии АИИС КУЭ ЕНЭС ПС 220 кВ «Усть-Лабинская»,,"Пределы допускаемой относительной погрешности ИК при измерении активной электрической энергии в рабочих (δ), условиях эксплуатации АИИС КУЭ (δ), % δ100 %, ±1,0",2016-64671-16.pdf,
652,Манометры показывающие MB801,"Диапазон измерений давления, МПа","Пределы основной допускаемой приведенной погрешности (при 20±2 °С), % (от измерения давления (при температуре 20±2 °С), % (от диапазона измерений) ±1,0 измерений)",2016-64718-16.pdf,МПа
653,Манометры показывающие MB801,"Диапазон измерений давления, МПа","Пределы основной допускаемой приведенной погрешности (при 20±2 °С), % (от измерения давления (при температуре 20±2 °С), % (от диапазона измерений) ±1,0 измерений)",2016-64719-16.pdf,МПа
654,Газоанализаторы ФП34,"Диапазон измере- ний (показаний) определяемого определяемого компонента, объ- компонента, объ- емная доля, % 0 5","Пределы до- пускаемой по- основной по- грешности ±0,1 об.д., % ±5% или ±5% от показаний показаний (выбираем (выбираем большее из большее из значений) значений)",2016-64863-16.pdf,объ
655,Система автоматизированная информационно-измерительная коммерческого «Крыловский учета электрической энергии и мощности ФГУП «Крыловский государственный центр» «ЦНИИ СЭТ» научный центр» филиал «ЦНИИ СЭТ»,,"Таблица 4- Пределы допускаемых относительных погрешностей (измерение активной и реак- тивной электрической энергии и мощности), % для рабочих условий эксплуатации Зна- ±2,4 ±3,3",2016-64914-16.pdf,
656,Резервуар вертикальный стальной с плавающей крышей М0041-ТК-В007,"технические м3 Номинальная вместимость, м3 Пределы допускаемой относительной 100000; ±0,1;","Пределы допускаемой относительной погрешности определения вместимости, % ±0,1; размеры:",2016-65153-16.pdf,м3
657,Система автоматизированная информационно-измерительная коммерческого (АИИС КУЭ) «НижегородЭнергоТрейд» учета электроэнергии (АИИС КУЭ) ООО «НижегородЭнергоТрейд» (ОАО «Рикор Электроникс») (ОАО «Рикор Электроникс»),,"Основ- ная погреш- погреш- ность, % ±1,2",2016-65171-16.pdf,
658,"Модули измерительные KAD/ADC/111, KAM/ADC/111","Диапазон измерений напряжения посто- тока, янного тока, В","Пределы допускаемой приведенной (к измерений) из- диапазону измерений) погрешности из- тока, мерений напряжения постоянного тока, % % ±0,05",2016-65230-16.pdf,янного
659,Термометры инфракрасные КЕЛЬВИН ПИРОЦЕЛЬС,"Диапазон измерений температу- ры, °С излучатель-","Пределы допускаемой абсолют- ной погрешности измерений, °С ±(1 + 0,01·│Т│), – показания пирометра где Т – показания пирометра",2016-65270-16.pdf,°С
660,Система автоматизированная информационно-измерительная коммерческого (АИИС КУЭ) ЭС-1 «Невский» учета электроэнергии (АИИС КУЭ) ЭС-1 Центральной ТЭЦ филиала «Невский» «ТГК-1» (действующие электроустановки) ОАО «ТГК-1» (действующие электроустановки),,"погрешность ИК (± δ), % Основная относительная 0,6",2016-65283-16.pdf,
661,Системы мобильного фото-видеомониторинга и картографирования Imajbox® S,,"Доверительные границы абсолютной погрешности (при вероятности 0,95) фотоснимка, определения координат местоположения объекта по кадру фотоснимка, расположенного в направлении движения вдоль трассы на расстоянии не 10 м, ГЛОНАСС/GPS более 10 м, при работе по сигналам ГНСС ГЛОНАСС/GPS с использованием штатной всенаправленной антенны при значении GDOP 3, м, более: геометрического фактора точности GDOP не более 3, м, не более: - 1,5 2,0 - в плане - по высоте",2016-65385-16.pdf,
662,Система измерительная автоматизированной системы управления технологиче- ским процессом транспортировки и вдувания пылеугольного топлива в доменную 2 «ЕВРАЗ ЗСМК» печь № 2 доменного цеха АО «ЕВРАЗ ЗСМК»,,"Границы до- пускаемой основной погрешности ИК γ=±0,6 %",2016-65406-16.pdf,
663,Система автоматизированная информационно-измерительная коммерческого учета электроэнергии (АИИС КУЭ) Государственной компании «Автодор» учета электроэнергии (АИИС КУЭ) Государственной компании «Автодор» а/д М-4 Московская область а/д М-4 Московская область,,"Границы интервала основной основной относи- относи- тельной погреш- погреш- ности из- мерений, (±δ), %, при (±δ), %, при дове- дове- рительной вероятности P=0,95 P=0,95 1,0",2016-65429-16.pdf,
664,Комплексы фотоэлектронные измерительные ФЭБ-4СМ,"Диапазон измеряемых скоростей, м/с","Предел допускаемой относительной среднеквадратической погрешности скорости, % измерения скорости, % скоростей, 0,15 100…2000",2016-65433-16.pdf,м
665,Устройства контроля веса УКВ,"Максимальная нагрузка (Max), г 2 000 Минимальная нагрузка (Min), г 20","Пределы допускаемой средней погрешности при автоматическом (в эксплуатации), г, режиме работы при первичной поверке (в эксплуатации), г, для нагрузок: для нагрузок: от 0 до 500 г от 0 до 500 г включ. св. 500 г до Max включ. ±0,5 (±1) ±1 (±2) св. 500 г до Max включ. Пределы допускаемого стандартного ±1 (±2)",2016-65442-16.pdf,г
666,Система автоматизированная информационно-измерительная коммерческого учета электроэнергии АИИС КУЭ ЕНЭС МЭС Волги с использованием элементов №11 «Саратовская ГЭС» АИИС КУЭ №11 ОАО «Саратовская ГЭС»,,"Основная относительная погрешность ИК, (±δ), % 1,0 0,6",2016-65472-16.pdf,
667,Резервуары железобетонные прямоугольные ЖБР-2000,"Номинальная вмести- мость, м3 отно-","Пределы допускаемой отно- сительной погрешности ре- зервуара, при определении вместимости, % ±0,2 вместимости, %",2016-65500-16.pdf,м3
668,Анализатор электрических цепей низкочастотный Bode 100,"Уровень мощности выходного сигнала генератора, дБм *","Пределы допускаемой относительной погрешности уровня мощности генератора, дБ на частотах от 1 Гц до 1 МГц ±0,3 на частотах от 1 Гц до 1 МГц ±0,3 на частотах свыше 1 МГц до 40 МГц ±0,6 на частотах свыше 1 МГц до 40 МГц ±0,6 допускаемой относительной погрешности частоты",2016-65578-16.pdf,дБм
669,Датчики угловых перемещений ПУИ 062,"1 Диапазон измерений угловых перемещений,…о сигнала,","Пределы допускаемой основной приведенной к наибольшему пределу измерений погрешности измерений угловых перемещений, % измерений погрешности измерений угловых перемещений, % ±1,2",2016-65629-16.pdf,
670,Система автоматизированная информационно-измерительная коммерческого учета электроэнергии АИИС КУЭ ЕНЭС МЭС Востока с использованием учета электроэнергии АИИС КУЭ ЕНЭС МЭС Востока с использованием элементов АИИС КУЭ тяговых подстанций Забайкальской ЖД - филиала элементов АИИС КУЭ тяговых подстанций Забайкальской ЖД - филиала ОАО «Российские железные дороги» в границах Амурской области ОАО «Российские железные дороги» в границах Амурской области,,"Основная относительная ИК, (±δ), % погрешность ИК, (±δ), % 1,5",2016-65698-16.pdf,
671,Анализаторы динамические механические модификаций RSA-G2 и DMA Q800,"Диапазон измерений температуры об- разцов*, C° Диапазон измерений разцов*, C° Диапазон измерений частоты, Гц Диапазон измерений линейных размеров образцов, Диапазон измерений образцов, мм Диапазон измерений силы, Н Диапазон показаний частоты, Гц размеры,","Пределы допускаемой абсолютной по- температуры, Пределы допускаемой абсолютной по- грешности измерений температуры, ˚С частоты, ±1,0 Пределы допускаемой относительной частоты, % Пределы допускаемой относительной погрешности измерений частоты, % ±1,0 Пределы допускаемой относительной раз- ±3 погрешности измерений линейных раз- меров, % меров, % Пределы допускаемой относительной силы, % Пределы допускаемой относительной погрешности измерений силы, % частоты, ±3,0",2016-65714-16,Гц
672,Калибратор-измеритель напряжения и силы тока Keithley 2612,"Предел измерений, В","Пределы допускаемой основной погрешности измерений, В [при температуре окружающего воздуха (23 ±5) °С] [при температуре окружающего воздуха (23 ±5) °С] ±(0,0002 U + 0,000375) ±(0,0002 U + 0,000375) ±(0,0002 U + 0,000600)",2016-65766-16.pdf,В
673,Система измерительная автоматизированной системы регулирования параметров 1 кислородно-конверторного машины непрерывного литья заготовок № 1 кислородно-конверторного цеха «ЕВРАЗ ЗСМК» АО «ЕВРАЗ ЗСМК»,,"Границы допускаемой основной погрешности ИК ИС γ=±0,6 %",2016-65805-16.pdf,
