,name,unit,error,file_name,true_unit
0,Трансформатор напряжения эталонный мобильный NUES 750 тоЬ,"номинальные первичные напряжения, кв",,2005-30815-05.pdf,кв
1,,,,2008-01054-08.pdf,
2,Счетчики скоростные крыльчатые холодной и горячей воды холодной и горячей воды СквiСквг9оi скв-гкi СквiСквг9оi скв-гкi Сквг9о-гкiСквг i sо-гк sо-гк Сквг9о-гкiСквг i sо-гк,ду 10 мм мм 10 мм,"Пределы допускаемых значений относительной погрешности в относительной погрешности в интервалах измеряемого расхода, интервалах измеряемого расхода, °/о от Qmin до Qt	 +5 ± 2 от Qmin до Qt	 от Qt (включительно)",2008-27361-04.pdf,
3,Счетчики активной электрической энергии трехфазные электрической энергии трехфазные СЕ 301 СЕ 301,имп/кВт • ч 8 Диапазон значений постоянной счетчика от 450 имп/кВт См.,"Пределы допускаемой	 основной	 по- грешности при измерении тока Б,, %, для счетчиков класса точности Пределы грешности грешности для для счетчиков класса точности 0,58 1 ± 2,0",2008-34048-08.pdf,
4,Системы ввода-вывода распределенные Га 1'уе1 I/О Га 1'уе1 I/О,,"пределы допускае- мой основной при- веденной погрешно- сти при температу - ре	 (+20 t 5) °С, t% 0,2",2008-34291-07.pdf,
5,Счетчики активной энергии переменного тока статические однофазные «АРБИТР»,"счетчика, имп/кВт ч Постоянная счетчика,",,2008-36028-07.pdf,имп
6,Вольтметры универсальные В7-53,"Измерение постоянного напряжения: - пределы измерений В; 200 мВ;2, 20, 200, 1000 В;","относительной погрешности измерений: 1) при 4 Уг разряда индикации: а) на пределах 200 мВ; 2, 20, 200 В ±[0,04 + 0,01(Ш/Ш - 1)] %;",2008-39123-08.pdf,2
7,Установка эталонная автоматизированная автоматизированная УЛР - 1 А,,"Предел допускаемой основной относи- тельной погрешности передачи разме- ров единиц коэффициента пульсаций , °/о, не более 3,0 °/о, не более Спектральный",2008-39753-08.pdf,
8,Термометры электронные цифровые ТР-5С,"Рабочий диапазон измеряемых температур, °С Пределы допускаемой абсолютной погрешности","..±0,2 0,1 Пределы допускаемой абсолютной погрешности , °С	 Дискретность, °С	",2008-39798-08.pdf,°С
9,"Тонометры автоматические ТМ «36,6» мод. HL-168FD ТМ «36,6» мод. HL-168FD","мм рт.ст. при измерении Диапазон измерений давления воздуха в манжете, мм Пределы допускаемой абсолютной погрешности при Диапазон Пределы","Пределы допускаемой абсолютной погрешности при измерении давления воздуха в компрессионной манжете, мм рт. ст. 	 давления воздуха в компрессионной манжете, мм рт. ст. 	 Диапазон измерений частоты пульса, 1 /мин 	 	 ± 3",2008-39998-08.pdf,мм
10,Приемники временной синхронизации NAVIOR-24S,,"Предел допускаемой средней квадратической погрешности формирования метки времени, времени, выдаваемой потребителям, по отношению к шкале времени, нс : - ПТС($ЕТ)	 - ПТС($ЕТ)	 - ИТС(US)	 50; 50. - ИТС(US)	 50.",2008-40005-08.pdf,
11,Динамометры измерительные СИУ2 СИУ2,"Наибольший предел измере- предел измере- ний (НПИ), кН кН","Пределы допускаемой относительной погрешности , °/о погрешности , °/о ± 0,06 ± 0,45",2008-40143-08.pdf,кН
12,"Калибраторы температуры серии МгсгоСа1 моделей МгсгоСа1 Т10, МгсгоСа1 моделей МгсгоСа1 Т10, МiсгоСа1 Т30, МгсгоСа1 Т350 МiсгоСа1 Т30, МгсгоСа1 Т350","Диапазон воспроизведения температу- ры, °С Пределы допускаемой погрешности °С Пределы","Пределы допускаемой погрешности воспроизведения температуры, °С 0,5 воспроизведения температуры, °С Дискретность показаний, °С",2008-40160-08.pdf,°С
13,"Фурье - спектрометры инфракрасные Varian (модели 640IR, 660IR, 670IR, 680IR, FT-IR Oi1 Analyzer)","см- ' Спектральный диапазон (основной),","Пределы допускаемой абсог ютной погрешности шкалы волновых чисел, см"" +0,25 шкалы волновых чисел, см""",2008-40223-08.pdf,
14,"Система автоматизированная информационно- измерительная коммерческого учета электроэнергии (АИИС КУЭ) электроэнергии (АИИС КУЭ) ОАО «КНАУФ ГИПС Баск нчак» ОАО нчак» Консалтинг», ОАО «КНАУФ ГИПС Баск нчак» Изготовлена 000 «ИТФ Консалтинг»,",,"Предел допускаемой относительной погрешности измерения активной электрической энергии в рабочих условиях эксплуатации АИИС КУЭ ОАО «КНАУФ ГИПС Баскунчак» энергии в рабочих условиях эксплуатации АИИС КУЭ ОАО «КНАУФ ГИПС Баскунчак» +1,9 +3,0",2008-40241-08.pdf,
15,"(в технологических Системы телемеханики и автоматики для учета и управления энергоресурсами нейшем АПСТМ-ИС) служат для непрерывного измерения и контроля технологических телемеханики АПСТМ-ИС) (давления, температуры,",,"Пределы допускаемой основной приведенной погрешности измерения давления, перепа- да давления, температуры, тока, напряжения, потенциала, расхода и др. по 1.1 равны + 0.25 °/о при использовании первичных преобразователей класса точности 0.15, + 0.4 при использова-",2009-19243-05.pdf,
16,Генераторы нулевого воздуха ГНГ-01,"Массовая концентрация примеси в нулевом воздухе (С*), не более, мг/м3",Пределы допускаемой абсолютной погрешности поддержания давления в течение 8 ч непрерывной работы t 25 кПа.,2009-26765-04.pdf,не
17,Анализаторы гематологические КХ-21М,"Диапазон измерений содержания определяемого параметра: ИВС, х103 /мкл RBC, 106 - ИВС,","Предел допускаемой случайной составляющей относительной погрешности при измерении содержания определяемого параметра (СКО), %о *) - УВС 3,5 2,0",2009-27461-09.pdf,х1
18,Комплексы программно-технические измерительные «Апогей»,,"Пределы допускаемой допускаемой основной основной приведенной приведенной погрешности, погрешности, от диапазо- °/о от диапазо- на измерений (0,4",2009-27925-09.pdf,
19,Счетчики активной электрической энергии однофазные СЕ 200 СЕ 200,"имп./кВт.ч 2,5) Гц или (60 Диапазон значений постоянной счетчика Рабочий диапазон изменения частоты изме-",,2009-31721-09.pdf,
20,"Станки балансировочные ВОХЕК модели $1200, $1500, $1800, $3300, $1250, $1550, $1850 $1550, $1850","Диапазоны измерений вели- чины	 неуравновешенной массы дисбаланса, г: -","Пределы допускаемой абсо- лютной погрешности изме- рений угла установки кор- ректирующей массы,.. .° ±3 ±3",2009-38558-09.pdf,г
21,Устройство для поверки системы RM312 по параметру планшетности,"Диапазон задания отклонений от планшетности , единицы 1","Пределы допускаемого значения приведенной погрешности задания отклонений от планшетности , °/о ± 0,1",2009-40366-09.pdf,единицы
22,Весы - компаратор НС-30КЕ,"Наибольший предел взвешивания (НПВ), кг	","Среднеквадратическое отклонение (СКО), не более, г	 0,222",2009-40421-09.pdf,кг
23,Преобразователи расхода турбинные Parity Parity,,"Пределы допускаемой относительной погрешности при измерении объема, %(при отклонении вязкости измеряе- + 0,15 измерении объема, %(при отклонении вязкости измеряе- мой среды от вязкости при поверке не более 3 сСт) Импульсный выходной сигнал",2009-40543-09.pdf,
24,Система автоматизированная информационно - измерительная коммерческого учета электроэнергии ОАО «Автокран» ОАО «Автокран»,,"Основная погрешно сть, % сть, % ±0,95 ±1,42",2009-40698-09.pdf,
25,"Термометры сопротивления платиновые ""'ТИ моделей 2G, 2сои ""'ТИ моделей 2G, 2сои","°С минус Диапазон измеряемых температур (в зависимости от модели ТС), - для 2ОоН:	 от",,2009-40767-09.pdf,
26,СЧЕТЧИКИ ЭЛЕКТРИЧЕСКОЙ ЭНЕРГИИ ТРЕХФАЗНЫЕ ЭНЕРГИИ ТРЕХФАЗНЫЕ СТАТИЧЕСКИЕ ПСЧ-4АР.05.2М ПСЧ-4АР.05.2М СТАТИЧЕСКИЕ ПСЧ-4АР.05.2М,"- при измерении реактивной энергии Постоянная счетчика, имп/кВт •ч - в основном режиме (А)",,2009-40960-09.pdf,имп
27,Счетчики газа объёмные диафрагменные диафрагменные ГАММА 66 ГАММА 66,"Максимальный расход Qмакс, мз/ч оном, з/ч","Пределы допускаемой относительной погрешности в диапазо- не расходов при температуре +20 °С, (%): мин < Q < 0,1 оном мин < Q < 0,1 оном оном < Q < омакс :1:3 + 1,5",2009-41078-09.pdf,мз
28,"Ни в ел и р ы высокоточные оптические	 моделей	 AFL 241, AFL 281, AFL 321	 (с AFL 281, AFL 321	 321	 (с функцией автофокусирования)",,"Средняя квадратическая погрешность измерения 2,0 f 1,5 0,8 превышений на 1 км двойного кода, мм",2009-41141-09.pdf,
29,"Трансформаторы тока ТВЛ-0,66","А Номинальный первичный ток,",,2009-41169-09.pdf,
30,Дозаторы весовые непрерывного действия непрерывного действия ВДН ВДН,т/ч Диапазон предельной производительности	 Пределы допускаемой погрешности,"Пределы допускаемой погрешности по ГОСТ 30124-94, от НПП .	 по ГОСТ 30124-94, °/о от НПП .	 +0,25; Максимальная скорость ленты, не более , м/с 	",2009-41175-09.pdf,
31,ГЕНЕРАТОР ШУМА 346В,"Диапазон воспроизведения ИОШТ, дБ	","Пределы допускаемой абсолютной погрешности воспроизведения уровня ИОШТ, дБ : от 0,1 до 4,0 ГГц 	 0,30;",2009-41243-09.pdf,дБ
32,Аппаратура телемеханики присоединения АТГI,"напряжение переменного тока фазное, фазное, В","Пределы допускаемой приведенной погрешности измерений величин : - напряжение переменного тока фазное, °/о - 0,2",2009-41437-09.pdf,фазное
33,рН-метр РС-310,рН	 Диапазон измерений,"Пределы допускаемой абсолютной погрешности измерений рН ± 0,05 рН",2009-41713-09.pdf,
34,Весы электронные «RUBIS С-18»,"кг	 	 Наибольший предел взвешивания весов (НПВ) Наименьший предел взвешивания (НмПВ), кг 	","Пределы допускаемой погрешности, кг t 1",2009-41775-09.pdf,кг
35,Весы вагонные ВЭВ,Интервалы взвешивания св. 50 т до 200 т вкл .,"Пределы допускаемой погрешности ненагруженных весов после применения устройст- нуль, кг	 + 0,25 е пределов допус- ва установки на нуль,",2009-41999-09.pdf,
36,"Анализаторы цифро - аналоговые серии ЕАТ, модели ЕАТ TV/S/S2/С/ТС/STC, СОЕОР. TV/S/S2/С/ТС/STC ЕАТ, ЕАТ СОЕОР. TV/S/S2/С/ТС/STC","Диапазон измерений уровня сигнала на АЕ-входе, дБмкВ","Пределы допускаемой абсолютной погрешности абсолютной сигнала, дБмкВ f 1,5 измерения уровня сигнала,",2009-42507-09.pdf,дБмкВ
37,Система автоматизированная информацион- но-измерительная коммерческого учета элек- троэнергии (АНИС КУЭ) ГУП Владимирской области «Владимирское карьероуправленне» области «Владимирское карьероуправленне»,,"допускаемых погрешностей измерения активной электрической энергии Х3,8 f5,7",2009-42645-09.pdf,
38,Анализаторы общей серы в нефтепродуктах промышленные нефтепродуктах промышленные модель С6200$ модель С6200$,"°/о	 °/о	 Диапазон показаний массовой доли серы, Диапазон измерений массовой доли серы, ","Пределы допускаемой относительной погрешности, °/о ±30 - в диапазоне массовых долей серы от 0,0005 до 0,0025 °/о	",2009-42834-09.pdf,
39,Система автоматизированная информационно-измерительная коммерческого учета электроэнергии АИИС КУЭ ПС 110/10 кВ М 549 «ПОРТ»,,"Предел допускаемой абсолютной +5 погрешности кода часов, с/сутки",2009-42977-09.pdf,
40,Система автоматизированная информационно - измерительная коммерческого учета электроэнергии (АИИС КУЭ) ФГУП «УЭ НЦЧ РАН» ФГУП «УЭ НЦЧ РАН»,,"Погрешность в рабочих усло- виях, °/о виях, f1,7",2009-42983-09.pdf,
41,Система автоматизированная информационно- измерительная коммерческого учета электрической энергии ПС 220/110/10 кВ «Снежная» - АИИС КУЭ ПС 220/110/10 кВ «Снежная»,,"эксплуатации, ИК в рабочих Погрешность условиях ± % ± 5,0% ± 2,3%",2009-43035-09.pdf,
42,Измеритель перемещений лазерный ЛИП-01 М ЛИП-01 М,"м погрешности Диапазон измерений линейных перемещений, Пределы допускаемой абсолютной погрешности","Пределы допускаемой относительной погрешности из- мерений скорости, °/о ускорения, мм/с2 Х1,0* 0,01...0,001",2009-43157-09.pdf,м
43,Весы напольные РВ РВ,"Наибольший предел взвешивания (НПВ,), кг взвешивания (НПВ,), Наименьший предел",Пределы допускаемой погрешности при первичной поверке эксплуатации первичной поверке f 1 е f 1 е f 1 е,2009-43185-09.pdf,кг
44,Генераторы газовых смесей паров этанола в воздухе Alcotest СУЗ4,"Диапазон воспроизведения массовой концентрации этанола в газовых смесях, мг/мз",Пределы допускаемой погрешности воспроизведения массовой концентрации этанола в газовых смесях абсолютной абсолютной н 4 мг/мз,2009-43257-09.pdf,мг
45,Система нефтяного	 Система измерений	 количества Система измерений	 количества нефтяного	 газа	 ДНС	 2 нефтяного	 газа	 ДНС	 нефтяного	 газа	 ДНС	 2 Среднеугутского	 месторождения Среднеугутского	 Среднеугутского	 месторождения Среднеугутского	 месторождения 000 «РН — Юганскнефтегаз» 000 000 «РН — Юганскнефтегаз»,,"Пределы допускаемой относительной погрешности измерений : погрешности измерений : - объемного расхода газа, приведенного к условиям, - объемного расхода нормальным условиям, 3,0 нормальным условиям, °/о объема газа, приведенного",2009-43422-09.pdf,
46,"ультразвуковые ULM-SSN-02, ULM-SSN-06, Уровнемеры ультразвуковые модификаций ULM-SSN-02, Уровнемеры модификаций Уровнемеры ультразвуковые модификаций ULM-SSN-02, ULM-SSN-06, ULM-55N-IO, ULM-55Xi-02, ULM-55Xi-06, модификаций ULM-55N-IO, ULM-SSN-06, ULM-55Xi-06, ULM-SЗN-10, модификаций ULM-SSN-02, ULM-55N-IO, ULM-55Xi-02, ULM-SЗN-02, ULM-SЗN-06, ULM-55N-IO, ULM-55Xi-02, ULM-55Xi-06, ULM-SЗN-02, ULM-SЗN-06, ULM-SЗN-10, ULM-SЗN-20 ULM-SЗN-06, ULM-SЗN-20",величин •mnвня допускаемой величин •mnвня допускаемой основно величин Диапазон изм-ннй Пределы допускаемой величин изм-ннй допускаемой м основно,"Диапазон Пределы приведенной Диапазон изм-ннй •mnвня м допускаемой основно приведенной погрешности измерений й измерений Пределы допускаемой основно приведенной погрешности vnnвня, % основно й измерений ::1:.0,5 приведенной vnnвня, % Пределы допускаемой  более не более",2009-43521-09.pdf,
47,"Анализаторы спектра в реальном мас- штабе времени И$АЗЗОЗВ, И8А3308В, аАЗ4О8В аАЗ4О8В",,"0,1 Гц f Ооп•F +0,001 •ПО+2) Гц, где воп - погрешность опорной час- Пределы допускаемой абсолютной погрешности маркерно- го отсчета частоты воп значение час- воп - погрешность опорной час- тоты, ПО - полоса обзора, F - значение измеренной частоты значение измеренной частоты f 2.10-7",2009-43535-09.pdf,
48,"Спектрометры атомно-абсорбционные «КВАНТ - .ЭТА» «КВАНТ - .ЭТА» (модификации «КВАНТ - Z.ЭТА (модификации «КВАНТ Z.ЭТА -1», Т») (модификации «КВАНТ - Z.ЭТА «КВАНТ - 2.ЭТА - Т») «КВАНТ «КВАНТ - 2.ЭТА - Т») Т»)","нм зависимости Спектральный диапазон, Пределы обнаружения (в зависимости","Пределы допускаемого относительного СКО случайной составляющей погрешности измерения концентрации, %: измерения концентрации, %: Мышьяк Мышьяк ± 6,0 ± 4,0 при концентрации 5 мкг/дмз	 ± 6,0 при концентрации 30 мкг/дмз	 ± 4,0 при концентрации 30 мкг/дмз	 ± 4,0 Барий при концентрации 10 мкг/дмз	 ± 5,0 при концентрации 60 мкг/дмз	 ± 3,0 Медь при концентрации 5 мкг/дмз	 ± 5,0 при концентрации 30 мкг/дмз	 ± 3,0 при концентрации 30 мкг/дмз	 ± 3,0 Ртуть при концентрации 0,1 мкг/дмз	 ± 6,0 при концентрации 0,6 мкг/дмз	 ± 4,0 при концентрации 0,6 мкг/дмз	 ± 4,0 спектрометрического блока, мм, не более 	 1 060х405х4",2010-14981-10.pdf,нм
49,Датчики весоизмерительные тензорезисторные тензорезисторные 26 26,,"Техническая характеристика Пределы допускаемой погрешности для класса точности 01 по входу при первичной (периодической) поверке или калибровке, в входу при первичной (периодической) поверке или калибровке, в единицах поверочного интервала (v= Дтах/число поверочнох ин- единицах поверочного интервала (v= Дтах/число поверочнох ин- тервалов): до 50v вкл. ±0,35	 (±0,7^) ±0,7у (±1,4^)",2010-15400-07.pdf,
50,Комплекты задатчиков давления КЗД-01,"Линейное расстояние между торцом вставки и установочной площадкой задатчиков давления с индексами «5», «20», «40», «60» равно 2,5 мм.","Предел допускаемой абсолютной погрешности линейного расстояния между торцом вставки и установочной площадкой задатчиков давления с индексами «5», «20», «40», «60» f 0,05 мм. «60» составляет f 0,05 мм. Сила,",2010-19245-00.pdf,
