,name,unit,error,file_name,true_unit
815,Счетчики холодной и горячей воды турбинные «Смарт Митер»,"Диаметр условного прохода, мм Qmin, м3/ч","Пределы допускаемой относительной погрешности измерений объёма, погрешности измерений объёма, в диапазонах расходов, %: в диапазонах расходов, %: Qmin ≤ Q < Qt Qmin ≤ Q < Qt Qt ≤ Q ≤ Qmax ±5 Qt ≤ Q ≤ Qmax для счетчиков",2018-70357-18.pdf,мм
816,"Мерники металлические технические 1-го класса ММВ, ММГ",,"Пределы допускаемой относительной погрешности мерника при температуре +20 °С, вместимости, от номинального значения полной вместимости, % ±0,2",2018-70422-18.pdf,
817,"Автоцистерна АЦ-9,1","м3(л) Номинальная вместимость, м3(л) м3(л)","Пределы допускаемой относительной погрешности АЦ, как меры полной вместимости при +20 °С, % ±0,4 полной вместимости при +20 °С, %",2018-70444-18.pdf,м3
818,Трансформаторы тока измерительные SATEC HACS,Номинальная частота. Гц,"Пределы допускаемой токовой погрешности, %, для модификаций с неразъемным исполнением1, погрешности, %, для модификаций с неразъемным исполнением1, % от I1ном: исполнением1, при значениях первичного тока, I1, % от I1ном: 1 5 ±0,75 ±0,35",2018-70578-18.pdf,
819,Система измерительная АСУТП коммерческого учета ШФЛУ тит. 074/1 «ТАНЕКО» АО «ТАНЕКО»,,"Пределы допускаемой основной погрешности погрешности γ: ±0,15 %",2018-70580-18.pdf,
820,Система измерений количества и показателей качества нефти на УПН-1 (цех № 2). Возврат нефти с установки Возврат нефти с установки,"Диапазон измерений расхода, т/ч Пределы допускаемой относительной","Пределы допускаемой относительной погрешности, %: - измерений массы брутто нефти - измерений массы брутто нефти - измерений массы нетто нефти ±0,25 ±0,35",2018-70677-18.pdf,т
821,Шаблоны сварщика универсальные УШС-3,Диапазон измерений - мм,"Пределы допускаемой абсолютной погрешности измерений - мм ±0,5 ±0,5",2018-70742-18.pdf,
822,Измерители статических и динамических параметров микросхем КВК. ДИЦ. Э-16-001,"Диапазон измерений напряжения, В Диапазон измерений тока, мА","Пределы допускаемой относительной погрешности измерений напряжения, % Пределы допускаемой напряжения, % ±(0,1+0,2 Ак/Ах) -500,0 +500,0 Пределы допускаемой относительной погрешности измерений тока, % Пределы тока, % ±(0,5+0,2 Ак/Ах) -20,0 +20,0",2018-70757-18.pdf,В
823,Система измерений количества и показателей качества нефти на УСН-4/1 (цех 1). (цех № 1). Возврат нефти с установки,"Диапазон измерений расхода, т/ч","Пределы допускаемой относительной погрешности, %: - ±0,25 ±0,35",2018-70777-18.pdf,т
824,Уровнемеры импульсные радарные Pulsar R86 и Pulsar R96,"Диапазон измерений уровня, м","Пределы допускаемой абсолютной погрешности измерений уровня, мм - Pulsar R86 - Pulsar R86 - Pulsar R96 ±2 ±3",2018-70843-18.pdf,м
825,Система автоматизированная информационно-измерительная коммерческого учета «Сетевая компания» 2 электроэнергии ОАО «Сетевая компания» КЭС Южного РЭС 2,,"Границы допускаемой основной относительной погрешности, (±δ) % (±δ) % ±1,6",2018-70914-18.pdf,
826,Резервуары стальные вертикальные цилиндрические РВС-20000,"Номинальная вместимость, м3 м3 вместимость, м3 вместимость, м3","Пределы допускаемой относительной погрешности вместимости резервуара, % вместимости резервуара, % ±0,1 ±0,1 ±0,1",2018-71001-18.pdf,м3
827,Резервуары стальные вертикальные цилиндрические РВС-3000,"м3 Номинальная вместимость, м3","Пределы допускаемой относительной погрешности определения вместимости (при геометрическом методе), методе), % ±0,20 определения вместимости (при геометрическом методе),",2018-71099-18.pdf,м3
828,Резервуар стальной вертикальный цилиндрический РВС-2000,"Номинальная вместимость, м3","Пределы допускаемой относительной погрешности Пределы допускаемой относительной погрешности измерений вместимости (геометрический метод), % ±0,20",2018-71127-18.pdf,м3
829,Система измерительная массового расхода и массы бензина газового стабильного (БГС) цеха № 07 ЗБ ОАО «ТАИФ-НК» (БГС) цеха № 07 ЗБ ОАО «ТАИФ-НК»,"Диапазон измерений массового расхода бензина, т/ч","Пределы допускаемой относительной погрешности измерений массового расхода (массы) бензина измерений массового расхода (массы) бензина (значение массового расхода (массы) передается по HART-протоколу), % ±0,25",2018-71151-18.pdf,т
830,Твердомеры Бринелля EASY 3000,"Испытательные нагрузки для шкал Бринелля, Н","Пределы допускаемой относительной погрешности испытательных нагрузок для шкал Бринелля, % ±1,0",2018-71222-18.pdf,Н
831,"Барьеры изолирующие серий AMG1000, AM1000, AM2000", входных входных мА входных входных мА значений входных  значений входных 20 значений входных 20  значений  Диапазон до значений Диапазон до значений Диапазон  значений 0 Диапазон значений  Диапазон от Диапазон от Диапазон Диапазон тока тока тока тока  постоянного постоянного постоянного постоянного постоянного постоянного постоянного постоянного постоянного постоянного постоянного  Сила Сила Сила Сила,"  преобразований  +15  температуре преобразований диапазону +15 температуре +15   диапазону преобразований +15 условиях основной температуре +15 преобразований  диапазону условиях основной  температуре от преобразований диапазону значений) условиях температуре основной от диапазону значений) преобразований условиях температуре воздуха от  основной диапазону значений) преобразований воздуха температуре условиях основной преобразований диапазону значений) воздуха % температуре условиях основной преобразований условиях диапазону воздуха  значений) температуре условиях Пределы преобразований основной  диапазону значений) воздуха условиях °С, основной температуре преобразований °С, Пределы  значений) воздуха  (к температуре  преобразований нормальных воздуха Пределы значений) допускаемой  °С, (к преобразований нормальных Пределы нормальных при воздуха значений)   допускаемой приведенной  преобразований  +25 Пределы при окружающего нормальных допускаемой входных окружающего +25 приведенной  Пределы при погрешности окружающего входных нормальных допускаемой +25 приведенной Пределы  погрешности нормальных окружающего допускаемой измерений входных  приведенной окружающего погрешности нормальных до допускаемой входных измерений приведенной погрешности нормальных до допускаемой окружающего входных измерений приведенной погрешности допускаемой приведенной нормальных входных приведенной измерений окружающего допускаемой погрешности нормальных приведенной входных измерений окружающего окружающего допускаемой нормальных приведенной погрешности измерений допускаемой  окружающего погрешности в измерений приведенной в окружающего погрешности приведенной измерений погрешности окружающего измерений погрешности окружающего",2018-71223-18.pdf,
832,Устройства сбора и передачи данных MILUR IC 04,,"Пределы допускаемой основной абсолютной погрешности измерений Пределы допускаемой основной абсолютной погрешности измерений времени (в условиях отсутствия внешней синхронизации), с/сут ±3",2018-71252-18.pdf,
833,Спектрометры оптико-эмиссионные портативные Q4 MOBILE,"Диапазон измерений массовой доли элементов, %","Предел допускаемого относительного среднего квадратического отклонения результатов измерений выходного сигнала 1), %, отклонения результатов измерений выходного сигнала 1), %, в диапазонах измерений: в диапазонах измерений: - от 0,001 до 0,1 включ., % - от 0,001 до 0,1 включ., % - св. 0,1 до 1,0 включ., % 10 5",2018-71294-18.pdf,
834,Анализаторы общего содержания серы и хлора ТОХ-300,"Диапазон измерений массы хлора с использованием электролита для низких концентраций, мкг для низких концентраций, мкг Диапазон измерений массы хлора","Предел допускаемого относительного среднего квадратического отклонения результатов измерений массы хлора и серы, %, в диапазоне: в диапазоне: - от 0,05 до - от 0,05 до 5 мкг включ. 10",2018-71378-18.pdf,мкг
835,"Газоанализаторы с открытым оптическим трактом Senscient ELDS 1000, ELDS 2000","Диапазон измерений интегральной интегральной 1), концентрации НКПР∙м","Пределы допускаемой допускаемой основной основной приведенной приведенной погреш- ности 3) 4), % ±10",2018-71432-18.pdf,концентрации
836,Комплексы для измерений габаритных размеров APACHE conveyor conv8,"Диапазон измерений габаритных размеров, мм:","Пределы допускаемой абсолютной погрешности измерений габаритных размеров, мм: ±20",2018-71532-18.pdf,мм
837,Блоки регистрации электрических сигналов БРХВ,"Диапазоны измерений амплитуды переменного напряжения, мВ","Пределы допускаемой основной абсолютной погрешности измерений амплитуды переменного напряжения на частоте 1 кГц, % ±(0,01·Uвх+5) амплитуды переменного напряжения на частоте 1 кГц, % Пределы допускаемой дополнительной погрешности измерений,",2018-71690-18.pdf,мВ
838,Трансформаторы тока ТВ-220,"Номинальное напряжение, кВ Номинальный первичный ток,",,2018-71787-18.pdf,кВ
839,Трансформаторы тока ТФНД-220-I,,,2018-71788-18.pdf,
840,Система автоматизированная информационно-измерительная коммерческого учета электроэнергии АИИС КУЭ ЕНЭС ПС 220 кВ Сорочинская электроэнергии АИИС КУЭ ЕНЭС ПС 220 кВ Сорочинская,,"Границы интервала допускаемой относительной погрешности ИК при измерении активной электрической энергии в ИК при измерении активной электрической энергии в (δ), %, нормальных условиях эксплуатации АИИС КУЭ (δ), %, вероятности, 0,95 при доверительной вероятности, равной 0,95 δ1(2)%, %, %, δ1(2)%, ≤ I изм< I1(2)% ≤ I изм< I 5 % 3 ±1,0",2018-71795-18.pdf,
841,Аппаратно-программные комплексы оценки характеристик комплексированной навигационной аппаратуры навигационной аппаратуры,"Номинальные значения выходных частот, МГц: ГНСС ГЛОНАСС (L1) с частотным разделением","Пределы допускаемой абсолютной погрешности установки уровня мощности выходных сигналов, дБ уровня мощности выходных сигналов, дБ Доверительная граница абсолютной инструментальной ±0,28",2018-71873-18.pdf,МГц
842,Дефектоскопы ультразвуковые NOVOTEST УД3701,"Диапазон измерений глубины и координат залегания дефектов по стали, мм дефектов по стали, мм Диапазон измерений толщины","Пределы допускаемой абсолютной погрешности измерений глубины залегания дефекта и толщины, измерений глубины залегания дефекта и толщины, мм ±(0,5+0,01·Нх), – измеряемая глубина где Нх – измеряемая глубина залегания дефекта или толщина, залегания дефекта или толщина, мм",2018-72148-18.pdf,мм
843,Машины для испытаний материалов универсальные Tiratest,,"Пределы допускаемой относительной погрешности ±1 относительной погрешности из- мерений силы, % мерений силы, %",2018-72200-18.pdf,
844,Система автоматизированная информационно-измерительная коммерческого (АИИС КУЭ) «ЭнергоРесурс» (ГТП «Юбилейная») учета электроэнергии (АИИС КУЭ) ООО «ЭнергоРесурс» (ГТП «Юбилейная»),,"Пределы допускаемой относительной погрешности ИИК при изме- рении активной электрической энергии в рабочих условиях δ, % электрической энергии применения δ, % ±1,3 ±1,4",2018-72229-18.pdf,
845,Система оптическая измерительная M304 TECHNO,"Диапазон измерений диаметров, мм длин, Диапазон измерений длин, мм","Пределы допускаемой абсолютной погрешности диаметров, ±(1,5+D/200), измерений диаметров, мкм Пределы допускаемой абсолютной погрешности длин, ±(4+L/200), измерений длин, мкм",2018-72242-18.pdf,мм
846,Система автоматизированная информационно-измерительная коммерческого (АИИС КУЭ) «МИЛЛГРИН ЛИМИТЕД» учета электроэнергии (АИИС КУЭ) КОО «МИЛЛГРИН ЛИМИТЕД»,,"Основ- ная погреш- ность, % ность, % ±0,8",2018-72280-18.pdf,
847,Система автоматизированная информационно-измерительная коммерческого «Газпром энерго» «Газпром Москва» учета электроэнергии ООО «Газпром энерго» ООО «Газпром трансгаз Москва» КС-26 «Путятинская» КС-26 «Путятинская»,,"Границы основной погрешности, (±δ), % погрешности, (±δ), % 2,9 2,9",2018-72335-18.pdf,
848,Контроллеры многофункциональные ARIS MT200,,,2018-72363-18.pdf,
849,"Тестеры батарей АКИП-6302, АКИП-6302/1","Верхние пределы измерения сопротивления Rпр, Rпр, мОм Rпр,","Пределы допускаемой основной абсолютной погрешности(1), ±(0,004⋅Rизм+0,001⋅Rпр) погрешности(1), Ом",2018-72373-18.pdf,мОм
850,Резервуар стальной вертикальный цилиндрический РВС-12,"м3 Номинальная вместимость, м3","Пределы допускаемой относительной погрешности вместимости резервуара погрешности вместимости резервуара (объемный метод), % (объемный метод), % ±0,2",2018-72443-18.pdf,м3
851,"Резервуары стальные горизонтальные цилиндрические РГС-4, РГС-10, РГС-15, РГС-25 РГС-25","м3 Номинальная вместимость, м3","Пределы допускаемой относительной резервуара, погрешности вместимости резервуара, % ±0,25",2018-72450-18.pdf,м3
852,Система измерений количества и показателей качества нефти № 623 ПСП «Лопатино» ООО «САМАРАТРАНСНЕФТЬ - ТЕРМИНАЛ» ПСП «Лопатино» ООО «САМАРАТРАНСНЕФТЬ - ТЕРМИНАЛ»,"Диапазон массового расхода, т/ч","Пределы допускаемой относительной погрешности при измерении массы брутто нефти, % измерении массы брутто нефти, % ±0,25",2018-72485-18.pdf,т
853,"Анализаторы телевизионных и радиовещательных сигналов RANGERNeo 2, RANGERNeo 3, RANGERNeo 4 RANGERNeo 3, RANGERNeo 4",,"Пределы допускаемой абсолютной погрешности измерений сигнала, уровня входного телевизионного сигнала, дБмкВ ±1,5",2018-72500-18.pdf,
854,Ключи моментные электронные Garant серии 656650,"Диапазон воспроизведений силы, крутящего момента силы, Н∙м","Пределы допускаемой относительной погрешности воспроизведений силы, крутящего момента силы, % % ±4",2018-72548-18.pdf,крутящего
855,"Резервуары стальные вертикальные цилиндрические РВС-1000, РВСП-1000, РВС-2000, РВСП-2000 РВС-2000, РВСП-2000","м3 Номинальная вместимость, м3 Пределы допускаемой","Пределы допускаемой относительной погрешности относительной погрешности вместимости резервуара, % вместимости резервуара, % ±0,2",2018-72617-18.pdf,м3
856,Система автоматизированная информационно-измерительная коммерческого «Сетевая компания» 110 учета электроэнергии ОАО «Сетевая компания» ЕЭС ПС 110 кВ Сетяково,,"Границы основной погрешности, (±δ), % погрешности, (±δ), % 1,1 2,8",2018-72670-18.pdf,
857,Система автоматизированная информационно-измерительная коммерческого «Сетевая компания» 110 учета электроэнергии ОАО «Сетевая компания» КЭС ПС 110 кВ Южная,,"Границы основной погрешности (±δ), % погрешности (±δ), % 0,6 0,6",2018-72671-18.pdf,
858,Анализаторы-генераторы высокочастотных сигналов модульные NI PXIe-5840,"Диапазон частот кГц ГГц Fc,","Относительная погрешность заводской подстройки частоты δ0, не более Относительный годовой дрейф частоты δА, не более ±2·10-7 ±1·10-6",2018-72685-18.pdf,
859,Расходомеры-счетчики газа турбинные SM-RI-X,"Номинальный диаметр трубопровода, мм","Пределы допускаемой относительной погрешности измерений объемного расхода (объема), %: объемного расхода (объема), %: - при атмосферном давлении: - при атмосферном давлении: - Qmin - в диапазоне от Qmin до 0,2Qmax - в диапазоне от 0,2Qmax до Qmax ± 2,0 ± 0,5",2018-73301-18-1.pdf,мм
